<?xml version="1.0" encoding="UTF-8"?>
<dados xmlns="http://www.juicers.org"
    xmlns:xsi="http://www.w3.org/2001/XMLSchema-instance"
    xsi:schemaLocation="http://www.juicers.org data.xsd">

    <animal>
        <nome>Leopardo das neves</nome>
        <familia>Felinos</familia>
        <subfamilia>Pantherinae</subfamilia>
    </animal>
    <animal>
        <nome>Tigre dentes-de-sabre</nome>
        <familia>Felinos</familia>
        <subfamilia>Machairodontinae</subfamilia>
    </animal>
    <animal>
        <nome>Gato Dourado Africano</nome>
        <familia>Felinos</familia>
        <subfamilia>Felineos</subfamilia>
    </animal>
</dados>
